{"schema_version":"1.0.0","tool":{"id":"agent-rules-resolve","version":"0.1.0"},"status":"ok","complete":true,"data":{"profile":"agents-chain-v1","target":{"path":"src/backend/new.js","kind":"file","directory":"src/backend"},"precedence":"root-to-target","sources":[{"path":"AGENTS.md","directory":".","order":1,"sha256":"8f495eaf168072039d8c96ebe37baf0d7e6f0eba8e388ab7288cc08b7167d39c","bytes":103,"lines":3,"content":"# Repository instructions\n\nKeep changes focused. Verify affected behavior before reporting completion.\n"},{"path":"src/AGENTS.md","directory":"src","order":2,"sha256":"36d3869ffcb080f63efd3b7e1cae3870f50a1b3e26fff7d6f43f5808eb04b238","bytes":89,"lines":3,"content":"# Source instructions\n\nKeep module dependencies explicit and preserve public interfaces.\n"},{"path":"src/backend/AGENTS.md","directory":"src/backend","order":3,"sha256":"a03cd427c29179d89b9b13aa9ca0cef2f66b916edbd92ade70032d39eb1c6248","bytes":95,"lines":3,"content":"# Backend instructions\n\nValidate external input and avoid exposing credentials in diagnostics.\n"}],"ignored":[],"directories":[".","src","src/backend"],"include_content":true,"references":"not-followed"},"errors":[],"warnings":[],"meta":{"scope":"Explicit root-to-target local instruction chain; fixed profile, references not followed","limits":{"max_depth":64,"max_files":128,"max_file_bytes":65536,"max_total_bytes":262144,"max_output_bytes":524288,"max_duration_ms":5000}}}
